{
  "$schema": "https://json-schema.org/draft/2020-12/schema",
  "$id": "skill.schema.json",
  "title": "Compétence Educator",
  "description": "Une notion travaillée à une classe et une période, décrite par des règles de génération (SUB000106). Les exercices sont générés en direct, jamais stockés.",
  "type": "object",
  "additionalProperties": false,
  "required": [
    "id",
    "subject",
    "grade",
    "period",
    "title",
    "instruction",
    "operation",
    "formats",
    "answerModes",
    "source"
  ],
  "properties": {
    "$schema": {
      "type": "string"
    },
    "id": {
      "type": "string",
      "pattern": "^[a-z0-9]+(-[a-z0-9]+)*$",
      "description": "Identifiant stable, identique au nom du fichier (sans .json)."
    },
    "subject": {
      "enum": [
        "math"
      ]
    },
    "grade": {
      "enum": [
        "CP",
        "CE1",
        "CE2",
        "CM1",
        "CM2"
      ]
    },
    "period": {
      "type": "integer",
      "minimum": 1,
      "maximum": 5,
      "description": "Période de l'année scolaire : 1 rentrée → Toussaint, 2 → Noël, 3 → hiver, 4 → printemps, 5 → été."
    },
    "title": {
      "type": "string",
      "minLength": 1,
      "maxLength": 60,
      "description": "Titre court montré à l'enfant."
    },
    "instruction": {
      "type": "string",
      "minLength": 1,
      "maxLength": 120,
      "description": "Consigne affichée et lue au premier exercice."
    },
    "operation": {
      "enum": [
        "addition",
        "subtraction",
        "mixed",
        "multiplication",
        "numeration",
        "doubleHalf",
        "fraction",
        "problem"
      ],
      "description": "mixed : chaque exercice est une addition ou une soustraction. multiplication : tables et produits. numeration : nombres (centaines, lire, écrire, comparer, ranger, encadrer, droite graduée, parité). doubleHalf : doubles et moitiés. fraction : premières fractions. problem : problèmes générés à partir des gabarits de content/problems."
    },
    "operands": {
      "type": "array",
      "minItems": 2,
      "maxItems": 2,
      "description": "Calculs seulement (addition, subtraction, mixed, multiplication) : règle de l'opérande de gauche puis de droite (pour une soustraction, la gauche est le nombre dont on enlève).",
      "items": {
        "$ref": "#/$defs/operand"
      }
    },
    "constraints": {
      "$ref": "#/$defs/constraints"
    },
    "formats": {
      "type": "array",
      "minItems": 1,
      "uniqueItems": true,
      "items": {
        "enum": [
          "result",
          "missingOperand",
          "phrase",
          "recompose",
          "decompose",
          "placeValue",
          "writeNumber",
          "readNumber",
          "compare",
          "order",
          "frame",
          "numberLinePoint",
          "yesNo",
          "multiChoice",
          "fractionPicture",
          "fractionWords",
          "problem"
        ]
      },
      "description": "Formats de la famille : calculs result (7 + 5 = ?), missingOperand (7 + ? = 12 ; multiplication aussi 30 = 3 × ?), phrase (multiplication : 5 + 5 + 5 = ? × 5) ; numeration recompose, decompose, placeValue, writeNumber, readNumber, compare, order, frame, numberLinePoint, yesNo, multiChoice ; doubleHalf phrase, result ; fraction fractionPicture, fractionWords, compare, result ; problem problem."
    },
    "answerModes": {
      "type": "array",
      "minItems": 1,
      "uniqueItems": true,
      "items": {
        "enum": [
          "keyboard",
          "choice"
        ]
      },
      "description": "keyboard : l'enfant produit la réponse (pavé numérique, signes, glisser-déposer…) ; choice : il la choisit parmi des propositions."
    },
    "source": {
      "type": "string",
      "minLength": 1,
      "description": "Référence du programme officiel justifiant la règle."
    },
    "alsoOffered": {
      "type": "array",
      "uniqueItems": true,
      "description": "Autres classes (et période) où la compétence est aussi proposée, en révision (SUB000113). Par défaut, les compétences de la période 5 sont déjà proposées en période 1 de la classe suivante.",
      "items": {
        "type": "object",
        "additionalProperties": false,
        "required": [
          "grade",
          "period"
        ],
        "properties": {
          "grade": {
            "enum": [
              "CP",
              "CE1",
              "CE2",
              "CM1",
              "CM2"
            ]
          },
          "period": {
            "type": "integer",
            "minimum": 1,
            "maximum": 5
          }
        }
      }
    },
    "numbers": {
      "$ref": "#/$defs/operand",
      "description": "numeration : nombres travaillés."
    },
    "focus": {
      "type": "array",
      "minItems": 1,
      "uniqueItems": true,
      "items": {
        "type": "integer",
        "minimum": 0
      },
      "description": "multiplication : tables travaillées (70 % de la série) ; les autres valeurs des opérandes sont des révisions mêlées."
    },
    "progression": {
      "enum": [
        "mixed",
        "easyFirst"
      ],
      "default": "mixed",
      "description": "easyFirst : les exercices les plus faciles d'abord (× 2, × 5, × 10 ; petit facteur ; moitiés des dizaines paires)."
    },
    "picture": {
      "enum": [
        "arrayGrid"
      ],
      "description": "multiplication : rangées de points dessinées avec chaque calcul (3 × 5 : 3 rangées de 5)."
    },
    "doubles": {
      "$ref": "#/$defs/operand",
      "description": "doubleHalf : nombres dont on demande le double."
    },
    "halves": {
      "$ref": "#/$defs/operand",
      "description": "doubleHalf : nombres dont on demande la moitié (les nombres impairs sont ignorés)."
    },
    "timesTwentyFive": {
      "type": "array",
      "minItems": 1,
      "uniqueItems": true,
      "items": {
        "type": "integer",
        "minimum": 1,
        "maximum": 40
      },
      "description": "doubleHalf : multiples de 25 (3 → 3 × 25)."
    },
    "fractions": {
      "type": "object",
      "additionalProperties": false,
      "required": [
        "denominators"
      ],
      "properties": {
        "denominators": {
          "type": "array",
          "minItems": 1,
          "uniqueItems": true,
          "items": {
            "type": "integer",
            "minimum": 2,
            "maximum": 100
          }
        },
        "unitOnly": {
          "type": "boolean",
          "default": false,
          "description": "Seulement les fractions 1/b."
        }
      },
      "description": "fraction : dénominateurs utilisés."
    },
    "problems": {
      "type": "object",
      "additionalProperties": false,
      "required": [
        "kinds",
        "maxNumber"
      ],
      "properties": {
        "kinds": {
          "type": "array",
          "minItems": 1,
          "uniqueItems": true,
          "items": {
            "enum": [
              "partWhole",
              "transformation",
              "comparison",
              "twoSteps",
              "product",
              "sharing",
              "mixed"
            ]
          }
        },
        "maxNumber": {
          "type": "integer",
          "minimum": 1,
          "maximum": 1000000,
          "description": "Plus grand nombre des énoncés et des réponses."
        },
        "startMaxNumber": {
          "type": "integer",
          "minimum": 1,
          "description": "Plus grand nombre des premiers exercices de la série (60 %)."
        }
      },
      "description": "problem : types de problèmes (gabarits de content/problems) et taille des nombres."
    }
  },
  "$defs": {
    "operand": {
      "type": "object",
      "additionalProperties": false,
      "required": [
        "min",
        "max"
      ],
      "properties": {
        "min": {
          "type": "integer",
          "minimum": 0,
          "maximum": 100000
        },
        "max": {
          "type": "integer",
          "minimum": 0,
          "maximum": 100000
        },
        "multipleOf": {
          "type": "integer",
          "minimum": 1,
          "description": "Seulement les multiples de ce nombre (10 : dizaines entières)."
        },
        "values": {
          "type": "array",
          "minItems": 1,
          "uniqueItems": true,
          "items": {
            "type": "integer",
            "minimum": 0
          },
          "description": "Valeurs exactes autorisées (comprises entre min et max)."
        }
      }
    },
    "constraints": {
      "type": "object",
      "additionalProperties": false,
      "properties": {
        "minResult": {
          "type": "integer",
          "minimum": 0
        },
        "maxResult": {
          "type": "integer",
          "minimum": 0
        },
        "exactResult": {
          "type": "integer",
          "minimum": 0,
          "description": "Résultat imposé (compléments)."
        },
        "resultMultipleOf": {
          "type": "integer",
          "minimum": 1,
          "description": "Le résultat est un multiple de ce nombre (10 : complément à la dizaine)."
        },
        "carry": {
          "enum": [
            "any",
            "forbidden",
            "required"
          ],
          "default": "any",
          "description": "Retenue (addition) ou passage de la dizaine / emprunt (soustraction) dans au moins une colonne."
        },
        "excludeTrivial": {
          "type": "array",
          "uniqueItems": true,
          "items": {
            "enum": [
              "plusZero",
              "minusZero",
              "minusSelf"
            ]
          }
        }
      }
    }
  },
  "allOf": [
    {
      "if": {
        "properties": {
          "operation": {
            "enum": [
              "addition",
              "subtraction",
              "mixed",
              "multiplication"
            ]
          }
        }
      },
      "then": {
        "required": [
          "operands",
          "constraints"
        ],
        "properties": {
          "numbers": false,
          "doubles": false,
          "halves": false,
          "timesTwentyFive": false,
          "fractions": false,
          "problems": false
        }
      },
      "else": {
        "properties": {
          "operands": false,
          "constraints": false,
          "focus": false,
          "picture": false
        }
      }
    },
    {
      "if": {
        "properties": {
          "operation": {
            "const": "numeration"
          }
        }
      },
      "then": {
        "required": [
          "numbers"
        ]
      }
    },
    {
      "if": {
        "properties": {
          "operation": {
            "const": "fraction"
          }
        }
      },
      "then": {
        "required": [
          "fractions"
        ]
      }
    },
    {
      "if": {
        "properties": {
          "operation": {
            "const": "problem"
          }
        }
      },
      "then": {
        "required": [
          "problems"
        ]
      }
    }
  ]
}
