{
  "$schema": "../../schemas/skill.schema.json",
  "id": "cp-add-2-digits",
  "subject": "math",
  "grade": "CP",
  "period": 5,
  "title": "Additions de deux nombres plus petits que 100",
  "instruction": "Calcule.",
  "operation": "addition",
  "operands": [
    {
      "min": 10,
      "max": 89
    },
    {
      "min": 10,
      "max": 89
    }
  ],
  "constraints": {
    "maxResult": 99,
    "carry": "any"
  },
  "formats": [
    "result"
  ],
  "answerModes": [
    "keyboard",
    "choice"
  ],
  "source": "Programme de mathématiques du cycle 2 (arrêté du 22 octobre 2024, BO n°41 du 31 octobre 2024, en vigueur à la rentrée 2025), CP — calcul mental : ajouter deux nombres inférieurs à 100 (dizaines et unités séparément) ; addition posée en période 4 ou 5."
}
