{
  "$schema": "../../schemas/skill.schema.json",
  "id": "ce1-add-tables",
  "subject": "math",
  "grade": "CE1",
  "period": 1,
  "title": "Tables d'addition",
  "instruction": "Calcule ou trouve le nombre qui manque.",
  "operation": "addition",
  "operands": [
    {
      "min": 2,
      "max": 9
    },
    {
      "min": 2,
      "max": 9
    }
  ],
  "constraints": {
    "carry": "any"
  },
  "formats": [
    "result",
    "missingOperand"
  ],
  "answerModes": [
    "keyboard",
    "choice"
  ],
  "source": "Programme de mathématiques du cycle 2 (arrêté du 22 octobre 2024, BO n°41 du 31 octobre 2024, en vigueur à la rentrée 2025), CE1 — faits numériques : tables d'addition dans les deux sens, fluence renforcée toute l'année."
}
