{
  "$schema": "../../schemas/skill.schema.json",
  "id": "cp-sub-within-20",
  "subject": "math",
  "grade": "CP",
  "period": 3,
  "title": "Soustractions jusqu'à 20",
  "instruction": "Calcule ou trouve le nombre qui manque.",
  "operation": "subtraction",
  "operands": [
    {
      "min": 2,
      "max": 20
    },
    {
      "min": 1,
      "max": 10
    }
  ],
  "constraints": {
    "carry": "any",
    "excludeTrivial": [
      "minusZero",
      "minusSelf"
    ]
  },
  "formats": [
    "result",
    "missingOperand"
  ],
  "answerModes": [
    "keyboard",
    "choice"
  ],
  "source": "Programme de mathématiques du cycle 2 (arrêté du 22 octobre 2024, BO n°41 du 31 octobre 2024, en vigueur à la rentrée 2025), CP — soustraction travaillée dès la période 3."
}
