{
  "$schema": "../../schemas/skill.schema.json",
  "id": "ce1-double-half-facts",
  "subject": "math",
  "grade": "CE1",
  "period": 3,
  "title": "Doubles et moitiés à connaître",
  "instruction": "Trouve le double ou la moitié.",
  "operation": "doubleHalf",
  "doubles": {
    "min": 1,
    "max": 500,
    "values": [
      1,
      2,
      3,
      4,
      5,
      6,
      7,
      8,
      9,
      10,
      11,
      12,
      13,
      14,
      15,
      20,
      25,
      30,
      35,
      40,
      45,
      50,
      100,
      150,
      200,
      250,
      300,
      500
    ]
  },
  "halves": {
    "min": 2,
    "max": 1000,
    "values": [
      2,
      4,
      6,
      8,
      10,
      12,
      14,
      16,
      18,
      20,
      22,
      24,
      26,
      28,
      30,
      40,
      50,
      60,
      70,
      80,
      90,
      100,
      200,
      300,
      400,
      500,
      600,
      700,
      800,
      900,
      1000
    ]
  },
  "timesTwentyFive": [
    1,
    2,
    3,
    4
  ],
  "formats": [
    "phrase",
    "result"
  ],
  "answerModes": [
    "keyboard",
    "choice"
  ],
  "source": "Programme de mathématiques du cycle 2 (arrêté du 22 octobre 2024, BO n°41 du 31 octobre 2024, en vigueur à la rentrée 2025), CE1 — faits multiplicatifs usuels : doubles de 1 à 15 et de 20, 25, 30, 35, 40, 45, 50, 100, 150, 200, 250, 300, 500 ; moitiés des nombres pairs de 2 à 30, des dizaines de 40 à 100 et des centaines de 200 à 1 000 ; multiples de 25. Période 3 : choix d'Educator."
}
