{
  "$schema": "../../schemas/skill.schema.json",
  "id": "ce1-frac-compare-add",
  "subject": "math",
  "grade": "CE1",
  "period": 4,
  "title": "Comparer et ajouter des fractions",
  "instruction": "Compare les fractions, ou calcule.",
  "operation": "fraction",
  "fractions": {
    "denominators": [
      2,
      3,
      4,
      5,
      6,
      8,
      10
    ]
  },
  "formats": [
    "compare",
    "result"
  ],
  "answerModes": [
    "keyboard",
    "choice"
  ],
  "source": "Programme de mathématiques du cycle 2 (arrêté du 22 octobre 2024, BO n°41 du 31 octobre 2024, en vigueur à la rentrée 2025), CE1 — comparer des fractions de même dénominateur et de numérateur 1 (cas simples dès la période 4) ; additionner et soustraire des fractions de même dénominateur."
}
