{
  "$schema": "../../schemas/skill.schema.json",
  "id": "cp-sub-from-tens",
  "subject": "math",
  "grade": "CP",
  "period": 5,
  "title": "Enlever un petit nombre à une dizaine",
  "instruction": "Calcule ou trouve le nombre qui manque.",
  "operation": "subtraction",
  "operands": [
    {
      "min": 20,
      "max": 90,
      "multipleOf": 10
    },
    {
      "min": 1,
      "max": 9
    }
  ],
  "constraints": {
    "carry": "any"
  },
  "formats": [
    "result",
    "missingOperand"
  ],
  "answerModes": [
    "keyboard",
    "choice"
  ],
  "source": "Programme de mathématiques du cycle 2 (arrêté du 22 octobre 2024, BO n°41 du 31 octobre 2024, en vigueur à la rentrée 2025), CP — calcul mental : soustraire un nombre inférieur à 10 à un nombre entier de dizaines (50 − 6). Période choisie par Educator."
}
